{
  "schema": 1,
  "id": "repair-history-redaction-path-cap",
  "kind": "repair-negative",
  "disposition": "no-repair",
  "provenance": {
    "labeledBy": "devflow-maintainers",
    "labeledOn": "2026-08-15",
    "method": "hand-authored",
    "sourceKind": "synthetic",
    "reviewStatus": "unreviewed",
    "notes": "Repair-history storage policy case; models no replay failure."
  },
  "fixture": {
    "history": {
      "path": "../escape.repair-history.jsonl",
      "entries": 257,
      "contains": [
        "prompt",
        "source",
        "secret",
        "selector-text"
      ]
    }
  },
  "expect": {
    "diagnosticIds": [],
    "candidateKinds": [],
    "repairEligible": false,
    "ineligibilityCodes": [
      "repair-history-invalid"
    ]
  }
}
